{
  "schema_version": "0.1.0",
  "artifact_type": "evidence-ledger",
  "ledger_id": "evidence-ledger-YYYYMMDD-scope-0001",
  "run_id": "run-YYYYMMDD-scope-0001",
  "project": "server-market-deterministic-agentic-model",
  "entries": [
    {
      "evidence_id": "evidence-0001",
      "source_title": "",
      "source_type": "",
      "source_tier": "tier1",
      "observed_date": "YYYY-MM-DD",
      "source_locator": "",
      "retrieved_at": "",
      "retrieved_by_model": "",
      "retrieved_in_environment": "",
      "used_in_artifacts": [],
      "claim_class": "observed_fact",
      "fact_status": "captured",
      "notes": ""
    }
  ],
  "notes": "",
  "review_state": "not_reviewed",
  "unresolved_items": []
}
